{
  "caseVersion": "2.0.0",
  "familyId": "incident-escalation-maintenance",
  "caseId": "incident-escalation-maintenance.base",
  "title": "Incident escalation correction",
  "primaryTask": "maintenance",
  "evaluationLane": "conversational-correction",
  "businessDomain": "information-technology",
  "partition": "held-out",
  "upstreamOverlapGroup": "incident-escalation-maintenance",
  "knownRegression": false,
  "difficultyTags": [
    "routine",
    "single-source"
  ],
  "coverage": {
    "business-vs-elapsed-time": [
      "incident-escalation-maintenance.assertion.1"
    ],
    "cancellation-escalation-timeout": [
      "incident-escalation-maintenance.assertion.1"
    ]
  },
  "task": {
    "prompt": "Continue the supplied session. Change the accepted elapsed escalation interval to three hours while retaining the boundary-event identity.",
    "scope": {
      "requested": "Incident escalation correction",
      "excluded": [
        "process improvement unless explicitly requested"
      ]
    },
    "clarificationAnswers": [],
    "correctionTurns": [
      "Continue the supplied session. Change the accepted elapsed escalation interval to three hours while retaining the boundary-event identity."
    ]
  },
  "applicability": {
    "status": "supported",
    "capability": "source-driven-modeling-session",
    "reason": "Within the current declared public boundary.",
    "fixedBeforeExecution": true
  },
  "correctionContract": {
    "baselineRequired": true,
    "mutableElementIds": ["escalation-clock"],
    "removableElementIds": [],
    "allowedNewElements": [],
    "allowedElementChanges": [
      {
        "id": "escalation-clock",
        "field": "event.timeDuration",
        "from": "PT4H",
        "to": "PT3H"
      },
      {
        "id": "escalation-clock",
        "field": "event.timeDuration",
        "from": "PT3H",
        "to": "PT2H"
      }
    ],
    "allowedFlowChanges": [],
    "allowedNewFlows": []
  },
  "sourceArtifacts": [
    {
      "id": "incident-escalation-maintenance.source.1",
      "path": "inputs/handoff.json",
      "mediaType": "application/json",
      "sha256": "a8c56edf763ee9f58077b143b6822cb99733e98490353a59be79be070818949e",
      "role": "evidence",
      "viewpoint": "session owner",
      "provenance": {
        "classification": "synthetic-fiction",
        "sourceFamily": "OpenBPMN evaluation corpus",
        "sourceVersion": "1.0.0",
        "originalUrl": null,
        "authorshipRecord": "Authored for OpenBPMN issue #44; not client or operational material.",
        "retrievedAt": "2026-09-21",
        "rights": {
          "license": "MIT",
          "licenseUrl": "https://opensource.org/license/mit",
          "attribution": "OpenBPMN contributors"
        }
      },
      "transformationHistory": [
        "Authored directly in the declared format."
      ]
    }
  ],
  "reviewerMaterial": "reviewer/assertions.json",
  "variants": [
    {
      "id": "three-to-two-hours",
      "kind": "meaning-changing",
      "partition": "held-out",
      "prompt": "Continue the supplied session using the targeted correction. Change the accepted elapsed escalation interval to two hours while retaining the boundary-event identity.",
      "replacesSourceIds": [
        "incident-escalation-maintenance.source.1"
      ],
      "inputArtifacts": [
        {
          "id": "incident-escalation-maintenance.variant.three-to-two-hours.source.1",
          "path": "variants/three-to-two-hours/handoff.json",
          "mediaType": "application/json",
          "sha256": "07347154a0771079f7bab7eef52d20fa2af2b44137760649a94123c76ed39a70",
          "role": "evidence",
          "viewpoint": "session owner",
          "provenance": {
            "classification": "synthetic-fiction",
            "sourceFamily": "OpenBPMN evaluation corpus",
            "sourceVersion": "1.0.0",
            "originalUrl": null,
            "authorshipRecord": "Authored for OpenBPMN issue #44; not client or operational material.",
            "retrievedAt": "2026-09-21",
            "rights": {
              "license": "MIT",
              "licenseUrl": "https://opensource.org/license/mit",
              "attribution": "OpenBPMN contributors"
            }
          },
          "transformationHistory": [
            "Authored directly in the declared format."
          ]
        }
      ],
      "stableAssertionIds": [
        "incident-escalation-maintenance.assertion.2",
        "incident-escalation-maintenance.assertion.3"
      ],
      "changedAssertionIds": [
        "incident-escalation-maintenance.assertion.1"
      ]
    }
  ],
  "reviewStatus": {
    "machineIntegrity": "pass-at-authored-version",
    "independentAgentReview": "completed-for-consistency",
    "expertAdjudication": "not_run",
    "humanUsabilityReview": "not_run"
  }
}
