{
  "caseVersion": "2.0.0",
  "familyId": "vector-pdf-preservation",
  "caseId": "vector-pdf-preservation.base",
  "title": "Vector PDF claims intake",
  "primaryTask": "legacy",
  "evaluationLane": "legacy-recognition",
  "businessDomain": "insurance",
  "partition": "development",
  "upstreamOverlapGroup": "vector-pdf-preservation",
  "knownRegression": false,
  "difficultyTags": [
    "challenging",
    "single-source"
  ],
  "coverage": {
    "participant-handoffs": [
      "vector-pdf-preservation.assertion.1"
    ],
    "long-labels": [
      "vector-pdf-preservation.assertion.1"
    ]
  },
  "task": {
    "prompt": "Reconstruct only what the vector PDF depicts and cite ambiguous ownership.",
    "scope": {
      "requested": "Vector PDF claims intake",
      "excluded": [
        "process improvement unless explicitly requested"
      ]
    },
    "clarificationAnswers": [],
    "correctionTurns": []
  },
  "applicability": {
    "status": "unsupported",
    "capability": "pdf-semantic-import",
    "reason": "Exploratory corpus probe; current product contract does not implement this conversion.",
    "fixedBeforeExecution": true
  },
  "sourceArtifacts": [
    {
      "id": "vector-pdf-preservation.source.1",
      "path": "inputs/claims-intake.pdf",
      "mediaType": "application/pdf",
      "sha256": "32fef74b0d3676df450839351866dcf28efabdd2ab82b391f66770fc20e554da",
      "role": "evidence",
      "viewpoint": "legacy model owner",
      "provenance": {
        "classification": "synthetic-fiction",
        "sourceFamily": "OpenBPMN evaluation corpus",
        "sourceVersion": "1.0.0",
        "originalUrl": null,
        "authorshipRecord": "Authored for OpenBPMN issue #44; not client or operational material.",
        "retrievedAt": "2026-09-21",
        "rights": {
          "license": "MIT",
          "licenseUrl": "https://opensource.org/license/mit",
          "attribution": "OpenBPMN contributors"
        }
      },
      "transformationHistory": [
        "Authored directly in the declared format."
      ]
    }
  ],
  "reviewerMaterial": "reviewer/assertions.json",
  "variants": [
    {
      "id": "boxes-moved",
      "kind": "meaning-preserving",
      "partition": "development",
      "prompt": "Reconstruct only what the vector PDF depicts and cite ambiguous ownership.",
      "replacesSourceIds": [
        "vector-pdf-preservation.source.1"
      ],
      "inputArtifacts": [
        {
          "id": "vector-pdf-preservation.variant.boxes-moved.source.1",
          "path": "variants/boxes-moved/claims-intake.pdf",
          "mediaType": "application/pdf",
          "sha256": "5907cb3a880ce9bf7c9ca65e9ced961ccba6d7a41e579c459a4dd7069ff8c130",
          "role": "evidence",
          "viewpoint": "process owner",
          "provenance": {
            "classification": "synthetic-fiction",
            "sourceFamily": "OpenBPMN evaluation corpus",
            "sourceVersion": "1.0.0",
            "originalUrl": null,
            "authorshipRecord": "Authored for OpenBPMN issue #44; not client or operational material.",
            "retrievedAt": "2026-09-21",
            "rights": {
              "license": "MIT",
              "licenseUrl": "https://opensource.org/license/mit",
              "attribution": "OpenBPMN contributors"
            }
          },
          "transformationHistory": [
            "Authored directly in the declared format."
          ]
        }
      ],
      "stableAssertionIds": [
        "vector-pdf-preservation.assertion.1",
        "vector-pdf-preservation.assertion.2"
      ],
      "changedAssertionIds": []
    }
  ],
  "reviewStatus": {
    "machineIntegrity": "pass-at-authored-version",
    "independentAgentReview": "completed-for-consistency",
    "expertAdjudication": "not_run",
    "humanUsabilityReview": "not_run"
  }
}
